Name,Price
"Monitor Gamer LG 24MS500-B, 24 Pol, IPS, FHD, 5ms, 100Hz, HDMI, 24MS500-B","R$ 719,99"
"Monitor Gamer Gigabyte GS27QA, 27 Pol, IPS, QHD, 1ms, 180Hz, HDMI/DP, GS27QA","R$ 1.959,99"
"Monitor Gamer Gigabyte GS27FA, 27 Pol, IPS, FHD, 1ms, 180Hz, HDMI/DP, GS27FA","R$ 1.389,99"
"Monitor Gamer Gigabyte GS34WQC, 34 Pol, Curvo, VA, WQHD, 1ms, 120Hz, DP/HDMI, GS34WQC","R$ 2.569,99"
"Monitor Gamer Samsung Odyssey G3, 27 Pol, VA, FHD, 1ms, 180Hz, FreeSync, HDMI/DP, LS27DG300ELXZD","R$ 1.049,99"
"Monitor Gamer Duex DXMO238F75, 23.8 Pol, IPS, FHD, 1ms, 75Hz, FreeSync, HDMI/VGA, DXMO238F75","R$ 559,99"
"Monitor Gamer Duex DX270ZG, 27 Pol, Curvo, VA, FHD, 1ms, 240Hz, FreeSync, HDMI/DP, DX270ZG","R$ 959,99"
"Monitor Gamer AOC 27G2S, 27 Pol, VA, FHD, 1ms, 165Hz, FreeSync Premium, HDMI/DP, 27G2S-BK","R$ 949,99"
"Monitor Gamer Gigabyte GS32Q, 31.5 Pol, IPS, QHD, 1ms, 165Hz, DP/HDMI, GS32Q","R$ 2.099,99"
"Monitor Gamer Asus ROG Swift PG42UQ, 41.5 Pol, OLED, 4K UHD, 0.1ms, 138Hz, G-Sync, HDMI/DP, PG42UQ","R$ 9.599,99"
"Monitor Gamer AOC Agon Pro Porsche Design, 31.5 Pol, Mini Led, 4K, UHD, 1ms, 144Hz, HDMI/DP, PD32M","R$ 9.499,99"
"Monitor Gamer Acer Nitro ED340CU, 34 Pol, Curvo, QHD, 1ms, 100Hz, DP/HDMI, UM.CE0AA.H01","R$ 2.399,99"
"Monitor PCTop, 15.4 Pol, 5ms, 60Hz, VGA/HDMI, MLP154HDMI","R$ 299,99"
"Monitor Gamer Gigabyte GS27QC, 27 Pol, VA, QHD, 1ms, 165Hz, DP/HDMI, GS27QC","R$ 1.629,99"
"Monitor Gamer Gigabyte GS32QC, 32 Pol, Curvo, VA, QHD, 1ms, 165Hz, DP/HDMI, GS32QC","R$ 1.999,99"
"Monitor Gamer Redragon Surtr, 27 Pol, IPS, FHD, 1ms, 165Hz, FreeSync, HDMI/DP, GM27A2G-W","R$ 1.359,99"
"Monitor Gamer Duex DX270ZHK, 27 Pol IPS, FHD, 1ms, 165Hz, FreeSync, HDMI/DP, DX270ZHK","R$ 829,99"
"Monitor Gamer Duex DX240ZG, 24 Pol. IPS, FHD, 1ms, 165Hz, FreeSync, HDMI/DP, DX240ZG-165","R$ 769,99"
"Monitor Gamer Duex DX270QGP165, 27 Pol. IPS, QHD, 1ms, 165Hz, G-Sync, FreeSync, HDMI/DP, DX270QGP165","R$ 1.049,99"
"Monitor Bluecase Led, 21.5 Pol, TN, FHD, 75hz, 5ms, HDMI/VGA, Preto, BM22K2HVW","R$ 439,99"
"Monitor Gamer Gigabyte S55U, 54.6 Pol, VA, QHD, 2ms, 120Hz, FreeSync Premium, HDMI/USB, S55U","R$ 12.999,99"
"Monitor Gamer Gigabyte G27FC A 27"" Curvo 1ms 165Hz FHD FreeSync Premium Altura Ajustavel HDMI/DP, GIGABYTE G27FC A","R$ 1.499,99"
"Monitor LG, 19.5 Pol. TN, LED HD, 2ms, 60Hz, VGA/HDMI, 20MK400H-B","R$ 499,99"
"Monitor VX Pro VX230X, 23 Pol, FHD, 75Hz, HDMI/VGA, VX230X","R$ 389,99"
"Monitor Gamer Duex DX270ZGP, 27 Pol IPS, FHD, 1ms, 240Hz, G-Sync/FreeSync, HDMI/DP, DX270ZGP","R$ 959,99"
"Monitor Samsung UR550, 28, IPS, 4K UHD, 4ms, 60Hz, FreeSync, HDMI/DP, LU28R550UQLMZD","R$ 1.699,99"
"Monitor Gamer Samsung Odyssey G30, 24 Pol VA, FHD, 1ms, 144Hz, FreeSync, HDMI/DP, LS24BG300ELMZD","R$ 849,99"
"Monitor Gamer Cooler Master Tempest GP2711, 27 Pol, VA, QHD, 1ms, 165Hz, FreeSync, HDMI/DP, CMI-GP2711-BR","R$ 3.899,99"
"Monitor Gamer Cooler Master Tempest GP27Q, 27 Pol, IPS, WQHD, 1ms, 165Hz, FreeSync, G-Sync, HDMI/DP, CMI-GP27-FQS-BR","R$ 3.999,99"
"Monitor BRX 24, 24 Pol., 60Hz, HDMI/VGA, BRX24","R$ 599,99"
"Suporte Para Notebook e Monitor Zinnia SNT10, ZNO-ZSNT10-BL01","R$ 179,99"
"Monitor Gamer Mancer Horizon Z PRO, 27 Pol. VA, FHD, 1ms, 165Hz, FreeSync, HDMI/DP, MCR-HZNP27-BL01","R$ 789,99"
"Suporte Articulado Com Pistao a Gas Para 2 Monitores Zinnia Nimbo 200, 17 Pol. a 27 Pol., Preto, ZNO-ZNNBO200-BK01","R$ 219,99"
"Monitor Gamer Acer EK221Q, 21.5 Pol, VA, FHD, 1ms, 100Hz, FreeSync, HDMI/VGA, UM.WE1AA.H02","R$ 629,99"
"Monitor Gamer AOC 24B35HM2, 23.8 Pol, VA, FHD, 1ms, 100Hz, HDMI/VGA, 24B35HM2","R$ 649,99"
"Monitor Gamer Acer QG241Y M3BIIP, 23.8 Pol, IPS, FHD, 1ms, 180Hz, FreeSync Premium, HDMI/DP, UM.QQ1AA.302","R$ 899,99"
"Monitor Gamer Duex, 24 Pol, IPS, FHD, 1ms, 165Hz, FreeSync/G-Sync, HDMI/DP, DXMO24F165S","R$ 799,99"
"Monitor Gamer Duex DX270, 27 Pol, IPS, QHD, 1ms, 240Hz, Free-Sync/G-Sync, HDMI/DP, Branco, DX270QGP240W","R$ 1.149,99"
"Monitor Gamer AOC 27G4/P, 27 Pol, IPS, FHD, 0.5ms, 180Hz, G-Sync, HDMI/DP, 27G4-P","R$ 1.149,99"
"Monitor Gamer AOC 24G4/P, 24 Pol, IPS, FHD, 0.5ms, 180Hz, G-Sync, HDMI/DP, 24G4-P","R$ 999,99"
"Monitor Gamer Mancer Horizon Z PRO280H, 27 Pol, VA, FHD, 280Hz, 1ms, FreeSync/G-Sync, MCR-HZP280H-BL01","R$ 1.079,99"
"Monitor Gamer MSI MAG274QRFW, 27 Pol, IPS, WQHD, 1ms, 180Hz, FreeSync, HDMI/DP, Branco, MAG-274QRFW","R$ 2.099,99"
"Monitor Gamer MSI MAG274QRF-QD E2, 27 Pol, Rapid IPS, WQHD, 1ms, 180Hz, FreeSync, HDMI/DP, MAG-274QRF-QD-E2","R$ 2.389,99"
"Monitor Gamer MSI MAG256F, 24.5 Pol, Rapid IPS, FHD, 1ms, 180Hz, HDMI/DP, MAG-256F","R$ 999,99"
"Monitor Gamer MSI 491CQP QD-OLED, 49 Pol, Curvo, QD-OLED, DQHD, 0.3ms, 144Hz, HDMI/DP, MPG-491CQP-QD-OLED","R$ 9.699,99"
"Monitor Gamer MSI MAG275CQRF-QD, 27 Pol, Curvo, Rapid VA, WQHD, 1ms, 170Hz, FreeSync Premium, HDMI/DP, MAG-275CQRF-QD","R$ 2.539,99"
"Monitor Gamer MSI MAG325CQRF, 31.5 Pol, Curvo, Rapid VA, WQHD, 1ms, 170Hz, FreeSync Premium, HDMI/DP, MAG-325CQRF","R$ 2.999,99"
"Monitor Gamer MSI Optix MAG301RF, 29.5 Pol, Rapid IPS, WFHD, 1ms, 200Hz, HDMI/DP, OPTIX-MAG301RF","R$ 2.359,99"
"Monitor Gamer Benq GW2485TC, 24 Pol, IPS, FHD, 5ms, 75Hz, HDMI/DP, Preto, 9H.LKLLB.QBA","R$ 2.999,99"
"Monitor Gamer Pichau Nexus Wide S34, 34 Pol, VA, Ultrawide, Curvo, WQHD, 1ms, 165Hz, FreeSync/G-Sync, HDMI/DP, PG-NXSS34-BL01","R$ 1.579,99"
"Monitor Gamer TGT Altay Neo, 23.8 Pol, IPS, FHD, 1ms, 165Hz, FreeSync/G-Sync, HDMI/DP, TGT-ATTNEO-BL01","R$ 849,99"
"Monitor Gamer Galax HOF Lite Stellar I, 27 Pol, IPS, 4K, UHD, 1ms, 100Hz, HDMI/DP, Branco, HFLS27100WQ","R$ 999,99"
"Monitor Gamer Galax HOF Lite Stellar I, 27 Pol, IPS, 4K, UHD, 1ms, 100Hz, HDMI/DP, HFLS27100BQ","R$ 799,99"
"Monitor Gamer TGT Altay TS4, 27 Pol, IPS, FHD, 1ms, 180Hz, FreeSync, HDMI/DP, TGT-ATTS4-BL02","R$ 849,99"
"Monitor Gamer Philips Evnia, 42 Pol, OLED, 4K, UHD, 0.1ms, 138Hz, HDMI/DP, FreeSync Premium, 42M2N8900","R$ 11.699,99"
"Monitor Gamer Philips Evnia, 34 Pol, Mini Led, QHD, Curvo, 2.5ms, 165Hz, HDMI/DP, 34M2C7600MV","R$ 9.249,99"
"Monitor Gamer Acer Vero RL242Y, 23.8 Pol, IPS, FHD, 1ms, 100Hz, FreeSync, HDMI/VGA, RL242Y","R$ 749,99"
"Monitor VX Pro VX190G, 19 Pol, LED, HD, 5ms, 60Hz, HDMI/VGA, VX190G","R$ 269,99"
"Monitor Office VX Pro VX215G, 21.5 Pol, FHD, 14ms, 60Hz, HDMI/VGA, VX215G","R$ 319,99"
"Monitor Gamer Duex DX270KGP, 27 Pol, IPS, 4K, UHD, 1ms, 100Hz, FreeSync/G-Sync, HDMI/DP, Branco, DX270KGP100W","R$ 899,99"
"Monitor MSI PRO MP241CAW, 23.6 Pol, VA, FHD, 1ms, 75Hz, HDMI/DP, Branco, MP-241CAW","R$ 999,99"
"Monitor Gamer Duex DX270KGP, 27 Pol, IPS, 4K, UHD, 1ms, 100Hz, FreeSync/G-Sync, HDMI/DP, DX270KGP100","R$ 899,99"
"Monitor MSI Modern MD272QP Ultramarine, 27 Pol, IPS, WQHD, 4ms, 75Hz, HDMI/DP, MD-272QP-ULTRAMARINE","R$ 1.849,99"
"Monitor MSI Modern MD272XPW, 27 Pol, IPS, FHD, 1ms, 100Hz, HDMI/DP, Branco, MD-272XPW","R$ 1.529,99"
"Monitor MSI PRO MP2412C, 23.6 Pol, Curvo, VA, FHD, 1ms, 100Hz, HDMI/DP, PRO-MP2412C","R$ 789,99"
"Monitor MSI PRO MP275, 27 Pol, IPS, FHD, 1ms, 100Hz, HDMI/VGA, PRO-MP275","R$ 899,99"
"Monitor MSI PRO MP251, 24.5 Pol, IPS, FHD, 1ms, 100Hz, HDMI/VGA, PRO-MP251","R$ 819,99"
"Monitor MSI PRO MP245V, 23.8 Pol, VA, FHD, 1ms, 100Hz, HDMI/VGA, PRO-MP245V","R$ 669,99"
"Monitor Asus ProArt Display PA329CRV, 31.5 Pol, IPS, 4K UHD, sRGB 100, 60Hz, HDMI/DP, PA329CRV","R$ 4.399,99"
"Monitor Gamer Mancer Valak UZ2, 32 Pol, FHD, Curvo, 1ms, 165Hz, FreeSync, HDMI/DP, MCR-VLKUZ2-BL02","R$ 1.149,99"
"Monitor VST 17, 17 Pol, HD, 5ms, 60Hz, HDMI/VGA, VST-VST17-BL01","R$ 284,99"
"Monitor Gamer Mancer Valak ZX180, 27 Pol, VA, Curvo, FHD, 1ms, 180Hz, FreeSync, HDMI/DP, MCR-VZX180-BL02","R$ 899,99"
"Monitor Gamer Pichau Nexus W29, 29 Pol, VA, Ultrawide, WFHD, 1ms, 100Hz, FreeSync, HDMI/DP, PG-NXW29-BL01","R$ 1.059,99"
"Monitor Philips E Line, 27 Pol, IPS, 4K, UHD, 4ms, 60Hz, HDMI/DP, 278E1A","R$ 1.399,99"
"Monitor Gamer Cooler Master Tempest GZ2711, 27 Pol, OLED, QHD, 0,03ms, 240Hz, FreeSync Premium, HDMI/DP, CMI-GZ2711-BR","R$ 6.899,99"
"Monitor Gamer Gigabyte GS27F, 27 Pol, IPS, FHD, 1ms, 165Hz, DP/HDMI, GS27F","R$ 1.249,99"
"Monitor Gamer Pichau Nexus S360, 27 Pol, IPS, FHD, 1ms, 360Hz, Freesync, G-Sync, DP/HDMI, PG-NXS360-BL01","R$ 1.999,99"
"Monitor Gamer Level Elite Flat, 27 Pol, VA, FHD, 1ms, 240Hz, FreeSync e G-Sync, HDMI/DP, Preto, L2709SE","R$ 1.199,99"
"Monitor Gamer Mancer Horizon Z2, 27 Pol, VA, FHD, 100Hz, 1ms, HDMI/VGA, MCR-HZN27-BL2","R$ 679,99"
"Monitor Gamer Mancer Horizon Z2, 21.5 Pol, VA, FHD, 100Hz, 1ms, HDMI/VGA, MCR-HZN21-BL2","R$ 459,99"
"Monitor Gamer Mancer Horizon Z2, 24 Pol, VA, FHD, 100Hz, 1ms, HDMI/VGA, MCR-HZN24-BL2","R$ 529,99"
"Monitor Gamer Duex DX270QGP240, 27 Pol. IPS, QHD, 1ms, 240Hz, G-Sync, FreeSync, HDMI/DP, DX270QGP240","R$ 1.159,99"
"Monitor SZL17, 17 Pol, TN, HD, 3ms, 75Hz, HDMI/VGA, SZL-SZL17-BL01","R$ 329,99"
"Monitor Portatil Profissional Zinnia Vizion V2, 15.6 Pol, IPS, FHD, sRGB 100, 60Hz, FreeSync, Mini HDMI, ZNO-VZNV2-BL01","R$ 639,99"
"Monitor Zinnia Pegasi Pro UW29, 29 Pol, IPS, Ultrawide, WFHD, sRGB 100, 100Hz, FreeSync, HDMI/DP, ZNO-PGSIPRO-BL01","R$ 1.079,99"
"Monitor Zinnia Delfos E21.5, 21.5 Pol, TN, FHD, sRGB 94, 75Hz, HDMI/VGA, ZNO-DLFE215-BL01","R$ 519,99"
"Monitor Zinnia Delfos E19, 19 Pol, TN, HD, sRGB 95, 75Hz, HDMI/VGA, ZNO-DLFE19-BL01","R$ 379,99"
"Monitor Gamer AOC 24G2S, 23.8 Pol, VA, FHD, 1ms, 165Hz, FreeSync Premium, HDMI/DP, 24G2S-BK","R$ 799,99"
"Monitor Portatil Gamer Pichau Verse, 16 Pol, IPS, 2K, 1ms, 120Hz, FreeSync, Mini HDMI, PG-VRS-BL01","R$ 879,99"
"Monitor Gamer Asus ROG Swift PG32UQR, 32 Pol, IPS, 4K UHD, 1ms, 144Hz, FreeSync Premium/G-Sync, HDMI/DP, PG32UQR","R$ 7.499,99"
"Monitor Gamer Mancer Valak VX3H, 27 Pol, VA, Curvo, 2K, 1ms, 240Hz, FreeSync, HDMI/DP, MCR-VLKVX3H-BL01","R$ 1.399,99"
"Monitor Gamer Mancer Valak VX3, 27 Pol, VA, Curvo, 2K, 1ms, 180Hz, FreeSync, HDMI/DP, MCR-VLKVX3-BL01","R$ 1.069,99"
"Monitor Gamer AsRock CL25FF, 24.5 Pol, IPS, FHD, 1ms, 100Hz, FreeSync, HDMI/VGA, CL25FF","R$ 659,99"
"Monitor Gamer Mancer Valak Z3H, 24 Pol, IPS, 2K, 1ms, 180Hz, FreeSync e G-Sync, HDMI/DP, MCR-VKZ3H-BL01","R$ 929,99"
"Monitor Gamer Pichau Nexus Wide 29, 29 Pol, IPS, Ultrawide, WFHD, 1ms, 100Hz, FreeSync, HDMI/DP, PG-NXSW29-BL01","R$ 1.099,99"
"Monitor Gamer Pichau Nexus Wide 34, 34 Pol, VA, Ultrawide, Curvo, 2K, 1ms, 165Hz, FreeSync, HDMI/DP, PG-NXSW34-BL01","R$ 1.899,99"
"Monitor Gamer Pichau Athen V3, 27 Pol, IPS, FHD, 1ms, 100Hz, FreeSync, HDMI/VGA, PG-ATH27V3-BL01","R$ 934,99"
"Monitor Gamer Pichau Athen V3, 24 Pol, IPS, FHD, 1ms, 100Hz, FreeSync, HDMI/VGA, PG-ATH24V3-BL01","R$ 764,99"
"Monitor Gamer AOC Hero Quad Q27G2, 27 Pol, VA, QHD, 1ms, 155Hz, FreeSync Premium, Q27G2","R$ 1.459,99"
"Monitor Profissional Pichau Perseus Pro, 27 Pol. IPS, QHD, sRGB100, 75Hz, Base Ajustavel, HDMI/DP, PC-PRS27-MPP01","R$ 1.659,99"
"Monitor Gamer Mancer Valak Z180H, 23.6 Pol. VA, Curvo, FHD, 1ms, 180Hz, FreeSync e G-Sync, HDMI/DP, MCR-VKZ180H-BL01","R$ 779,99"
"Monitor Gamer Mancer Valak UZ32, 32 Pol Curvo, VA, FHD, 1ms, 165Hz, FreeSync, HDMI/DP, MCR-VKUZ32-PL01","R$ 1.249,99"
"Monitor Gamer Pichau Cepheus VPRO32, 32 Pol, VA, Curvo, 2K, 165Hz, 1ms, FreeSync, HDMI/DP, PG-CFV32-BL01","R$ 1.589,99"
"Monitor Gamer Benq Mobiuz EX2710S, 27 Pol, IPS, FHD, 1ms, 165Hz, FreeSync Premium, HDMI/DP, EX2710S","R$ 2.699,99"
"Monitor Gamer AOC Destiny, 24.5 Pol, VA, FHD, 240Hz, 0.5ms, FreeSync Premium, HDMI/DP, 25G3ZM","R$ 1.249,99"
"Monitor Gamer Aigo Darkflash E24SA, 23.8 Pol, FHD, 144Hz, 5ms, HDMI/DP/Tipo-C, E24SA","R$ 1.799,99"
"Monitor Gamer Asrock PG32QF2B, 31.5 Pol, VA, QHD, 1ms, 165Hz, FreesSync Premium, HDMI/DP, 90LXA020-A0B2A0V","R$ 1.499,99"
"Suporte Duplo Para Monitor Aigo Atlas2, Preto, ATLAS2-BK","R$ 199,99"
"Monitor Philips 49'' SuperWide W-LED Curvo LCD VA HDMI/DisplayPort/USB-C + WebCam, 499P9H/00","R$ 8.299,99"
"Monitor Gamer Gigabyte G34WQC A, 34 Pol VA Curvo, WQHD, 1ms, 144Hz, FreeSync Premium, HDMI/DP, GIGABYTE-G34WQC-A","R$ 2.999,99"
"Suporte Articulado Para 2 Monitores Brateck LDT63 C024, 17 Pol. a 32 Pol., Prata, LDT63-C024","R$ 309,99"
"Suporte Articulado Para Monitor Brateck LDT63 C012, 17 Pol. a 32 Pol., Prata, LDT63-C012","R$ 154,99"
"Suporte Para Monitor e TV Brateck, 37 Pol. a 70 Pol., Preto, LPA78-463","R$ 129,99"
"Suporte Para Monitor Brateck LDT66 C012, 17 Pol. a 32 Pol., Preto, LDT66-C012","R$ 99,99"
"Suporte Para Monitor Brateck LDT66, 17 Pol. a 32 Pol., Preto, LDT66-C01","R$ 74,99"
"Monitor Gamer Redragon Quartz, 23.8 Pol., VA, FHD, 1ms, 165Hz, FreeSync, HDMI/DP GM24H2G","R$ 1.129,99"
"Suporte Articulado Para 2 Monitores Zinnia TMS 180, 13 Pol. a 32 Pol., Preto, ZNO-TMS180-BL01","R$ 99,99"
"Suporte Para Monitor Zinnia TMS 90, 13 Pol. a 32 Pol., Preto, ZNO-TMS90-BL01","R$ 79,99"
"Monitor Gamer MSI Optix MAG274R2, 27Pol. IPS, FHD, 1ms, 165Hz, G-Sync, HDMI/DP, OPTIX MAG274R2","R$ 2.149,99"
"Suporte Articulado Para TV Zinnia Elysium PRO, 32 Pol. a 75 Pol., Preto, ZNO-ELYPRO-BL01","R$ 152,99"
"Suporte Para TV Zinnia Elysium, 26 Pol. a 60 Pol., Preto, ZNO-ELYM-BL01","R$ 33,99"
"Suporte Articulado Para 3 Monitores Zinnia Nimbo 300, 10 Pol. A 32 Pol., Preto, ZNO-ZBO300-BK01","R$ 179,99"
"Suporte Articulado Para TV Zinnia Rubra T100, 14 Pol. a 65 Pol., Preto, ZNO-RBRAT-BL01","R$ 59,99"
"Suporte Articulado Para TV Zinnia Rubra, 14 Pol. a 43 Pol., Preto, ZNO-RBRA-BL01","R$ 35,99"
"Suporte Para TV Zinnia Sirion, 32 Pol. a 60 Pol., Preto, ZNO-SRN-BL01","R$ 9,99"
"Suporte Para Monitor TGT TMS 55, 17 Pol. a 32 Pol., Preto, TGT-TMS55-BL01","R$ 129,99"
"Suporte Para TV Zinnia STV700, 32 a 70 Pol, Preto, ZNO-STV700-BL01","R$ 329,99"
"Suporte Para TV Zinnia STV550, 32 a 55 Pol, Preto, ZNO-STV550-BL01","R$ 309,99"
"Suporte Articulado Para 2 Monitores Cougar DUO35, Ate 35 Pol, Preto, CGR-SDA-SB-01","R$ 619,99"
"Suporte Para Monitor e TV Zinnia SMT50, 14 Pol. a 27 Pol., Preto, ZNO-SMT50-BL01","R$ 69,99"
"Suporte Articulado Com Pistao a Gas Para 2 Monitores Zinnia Nimbo 200, 17 Pol. a 27 Pol., Branco, ZNO-ZNNBO200-WH01","R$ 373,92"
"Suporte Articulado Com Pistao a Gas Para Monitor Zinnia Nimbo 100, 17 Pol. a 27 Pol., Preto, ZNO-ZNNBO100-BK01","R$ 129,99"
"Suporte Articulado Com Pistao a Gas Para Monitor Zinnia Nimbo 100, 17 Pol. a 27 Pol., Branco, ZNO-ZNNBO100-WH01","R$ 119,99"
"Molduras Para Remocao De Bordas Redragon Siv, 24 ou 27 Pol, Preto, GMK-913","R$ 359,99"
"Monitor Gamer Corsair Xeneon 32QHD165, 32 Pol. IPS, QHD, 1ms,165Hz, FreeSync Premium, HDMI/DP, CM-9020001","R$ 8.999,99"
"Monitor Gamer AOC Agon 31.5"" Curvo VA 165Hz 1ms FHD FreeSync VGA/HDMI/DP, AG323FCXE","R$ 1.439,99"
"Monitor Gamer Asus, 24 Pol, TN, FHD, 0.5ms, 165hz, FreeSync Premium e G-Sync, HDMI/DP, VG248QG","R$ 1.249,99"
